<?xml version="1.0" encoding="UTF-8"?>

<!ELEMENT root (data*)>
<!ELEMENT data (name,description?)>
<!ELEMENT name (#PCDATA) >
<!ELEMENT description (#PCDATA) >
